State,University Name,City,ZIP Code,Enrollment (approx.),Notes (Accessibility, Taxes, etc.)
AL,University of Alabama,Tuscaloosa,35487,"38,000","Tuscaloosa County commercial property tax ~0.33%. Accessible via I-20/59. Public transit available."
AL,Auburn University,Auburn,36849,"30,000","Lee County commercial property tax ~0.32%. Accessible via I-85. Local transit available."
AL,University of Alabama at Birmingham (UAB),Birmingham,35294,"22,000","Jefferson County commercial property tax ~0.56%. Major transportation hub (I-20, I-59, I-65). Public transit available."
AL,University of Alabama in Huntsville (UAH),Huntsville,35899,"9,000","Madison County commercial property tax ~0.40%. Accessible via I-565. Public transit available."
AL,University of South Alabama,Mobile,36688,"14,000","Mobile County commercial property tax ~0.47%. Accessible via I-10, I-65. Public transit available."
AL,Alabama State University,Montgomery,36104,"4,000","Montgomery County commercial property tax ~0.45%. Accessible via I-65, I-85. Public transit available."
AL,Alabama A&M University,Normal,35762,"6,000","Madison County commercial property tax ~0.40%. Accessible via I-565. Public transit available."
AL,Troy University,Troy,36082,"16,000","Pike County commercial property tax ~0.41%. Accessible via US Hwys 231 & 29. Limited public transit."
AL,Jacksonville State University,Jacksonville,36265,"9,000","Calhoun County commercial property tax ~0.50%. Accessible via US Hwy 431. Limited public transit."
AL,University of West Alabama,Livingston,35470,"2,500","Sumter County commercial property tax ~0.43%. Accessible via I-20/59. Limited public transit."
AL,University of Montevallo,Montevallo,35115,"2,500","Shelby County commercial property tax ~0.46%. Accessible via I-65. Limited public transit."
AL,Athens State University,Athens,35611,"3,500","Limestone County commercial property tax ~0.42%. Accessible via I-65. Limited public transit."
AZ,University of Arizona,Tucson,85721,"49,000","Pima County commercial property tax ~1.0%. Accessible via Sun Link streetcar. Public transit available."
AZ,Northern Arizona University,Flagstaff,86011,"29,000","Coconino County commercial property tax ~0.7%. Accessible via Mountain Line transit. Limited highway access."
AR,University of Arkansas,Fayetteville,72701,"29,000","Washington County commercial property tax ~0.9%. Accessible via Ozark Regional Transit."
AR,Arkansas State University,Jonesboro,72401,"13,000","Craighead County commercial property tax ~0.8%. Accessible via Jonesboro Economic Transit System (JETS)."
AR,University of Central Arkansas,Conway,72035,"10,000","Faulkner County commercial property tax ~0.7%. Limited public transit."
AR,University of Arkansas at Little Rock,Little Rock,72204,"9,000","Pulaski County commercial property tax ~1.1%. Accessible via Rock Region METRO."
AR,Arkansas Tech University,Russellville,72801,"9,000","Pope County commercial property tax ~0.6%. Limited public transit."
AR,Henderson State University,Arkadelphia,71999,"3,000","Clark County commercial property tax ~0.7%. Limited public transit."
AR,Southern Arkansas University,Magnolia,71753,"4,000","Columbia County commercial property tax ~0.6%. Limited public transit."
AR,University of Arkansas at Pine Bluff,Pine Bluff,71601,"2,500","Jefferson County commercial property tax ~0.9%. Limited public transit."
AR,University of Arkansas at Monticello,Monticello,71656,"3,000","Drew County commercial property tax ~0.7%. Limited public transit."
AR,University of Arkansas Fort Smith,Fort Smith,72903,"6,000","Sebastian County commercial property tax ~0.8%. Accessible via Fort Smith Transit."
CA,University of California, Berkeley,Berkeley,94720,"45,000","Alameda County commercial property tax ~1.1%. Accessible via BART."
CA,University of California, Davis,Davis,95616,"40,000","Yolo County commercial property tax ~1.1%. Accessible via Amtrak, Unitrans."
CA,University of California, Irvine,Irvine,92697,"37,000","Orange County commercial property tax ~1.0%. Accessible via OCTA."
CA,University of California, Los Angeles,Los Angeles,90095,"46,000","Los Angeles County commercial property tax ~1.2%. Accessible via LA Metro."
CA,University of California, Merced,Merced,95343,"9,000","Merced County commercial property tax ~1.1%. Accessible via The Bus."
CA,University of California, Riverside,Riverside,92521,"27,000","Riverside County commercial property tax ~1.1%. Accessible via RTA."
CA,University of California, San Diego,San Diego,92093,"42,000","San Diego County commercial property tax ~1.1%. Accessible via MTS Trolley."
CA,University of California, San Francisco,San Francisco,94143,"3,000","San Francisco County commercial property tax ~1.2%. Accessible via Muni Metro. (Primarily graduate/professional)."
CA,University of California, Santa Barbara,Santa Barbara,93106,"26,000","Santa Barbara County commercial property tax ~1.1%. Accessible via MTD."
CA,University of California, Santa Cruz,Santa Cruz,95064,"19,000","Santa Cruz County commercial property tax ~1.1%. Accessible via Santa Cruz METRO."
CA,California State University, Bakersfield,Bakersfield,93311,"11,000","Kern County commercial property tax ~1.1%. Accessible via Golden Empire Transit."
CA,California State University, Channel Islands,Camarillo,93012,"7,000","Ventura County commercial property tax ~1.1%. Accessible via VCTC."
CA,California State University, Chico,Chico,95929,"16,000","Butte County commercial property tax ~1.0%. Accessible via B-Line."
CA,California State University, Dominguez Hills,Carson,90747,"17,000","Los Angeles County commercial property tax ~1.2%. Accessible via LA Metro."
CA,California State University, East Bay,Hayward,94542,"15,000","Alameda County commercial property tax ~1.1%. Accessible via AC Transit, BART."
CA,California State University, Fresno,Fresno,93740,"25,000","Fresno County commercial property tax ~1.2%. Accessible via FAX."
CA,California State University, Fullerton,Fullerton,92831,"40,000","Orange County commercial property tax ~1.0%. Accessible via OCTA."
CA,California State University, Long Beach,Long Beach,90840,"39,000","Los Angeles County commercial property tax ~1.2%. Accessible via Long Beach Transit."
CA,California State University, Los Angeles,Los Angeles,90032,"27,000","Los Angeles County commercial property tax ~1.2%. Accessible via LA Metro."
CA,California State University, Maritime Academy,Vallejo,94590,"1,000","Solano County commercial property tax ~1.2%. Specialized focus."
CA,California State University, Monterey Bay,Seaside,93955,"7,000","Monterey County commercial property tax ~1.0%. Accessible via MST."
CA,California State University, Northridge,Northridge,91330,"39,000","Los Angeles County commercial property tax ~1.2%. Accessible via LA Metro."
CA,California State University, Sacramento,Sacramento,95819,"31,000","Sacramento County commercial property tax ~1.2%. Accessible via SacRT Light Rail."
CA,California State University, San Bernardino,San Bernardino,92407,"20,000","San Bernardino County commercial property tax ~1.1%. Accessible via Omnitrans."
CA,California State University, San Marcos,San Marcos,92096,"16,000","San Diego County commercial property tax ~1.1%. Accessible via NCTD Sprinter."
CA,California State University, Stanislaus,Turlock,95382,"10,000","Stanislaus County commercial property tax ~1.1%. Accessible via The Bus."
CA,San Diego State University,San Diego,92182,"36,000","San Diego County commercial property tax ~1.1%. Accessible via MTS Trolley."
CA,San Francisco State University,San Francisco,94132,"29,000","San Francisco County commercial property tax ~1.2%. Accessible via Muni Metro."
CA,San José State University,San José,95192,"35,000","Santa Clara County commercial property tax ~1.0%. Accessible via VTA Light Rail."
CA,California Polytechnic State University, San Luis Obispo,San Luis Obispo,93407,"22,000","San Luis Obispo County commercial property tax ~1.0%. Accessible via SLORTA."
CA,California State Polytechnic University, Pomona,Pomona,91768,"29,000","Los Angeles County commercial property tax ~1.2%. Accessible via Foothill Transit."
CA,Sonoma State University,Rohnert Park,94928,"9,000","Sonoma County commercial property tax ~1.1%. Accessible via Sonoma County Transit."
CA,Humboldt State University,Arcata,95521,"7,000","Humboldt County commercial property tax ~1.0%. Accessible via A&MRTS."
CO,University of Colorado Boulder,Boulder,80309,"37,000","Boulder County commercial property tax ~1.3%. Accessible via RTD."
CO,University of Colorado Colorado Springs,Colorado Springs,80918,"12,000","El Paso County commercial property tax ~1.3%. Accessible via Mountain Metro."
CO,University of Colorado Denver,Denver,80204,"15,000","Denver County commercial property tax ~1.3%. Accessible via RTD Light Rail."
CO,Colorado State University,Fort Collins,80523,"34,000","Larimer County commercial property tax ~1.2%. Accessible via Transfort."
CO,Metropolitan State University of Denver,Denver,80204,"19,000","Denver County commercial property tax ~1.3%. Accessible via RTD Light Rail."
CO,University of Northern Colorado,Greeley,80639,"11,000","Weld County commercial property tax ~1.2%. Accessible via GET."
CO,Colorado School of Mines,Golden,80401,"7,000","Jefferson County commercial property tax ~1.2%. Accessible via RTD."
CO,Fort Lewis College,Durango,81301,"3,500","La Plata County commercial property tax ~0.8%. Accessible via Durango Transit."
CO,Western Colorado University,Gunnison,81231,"3,000","Gunnison County commercial property tax ~0.8%. Accessible via RTA."
CO,Adams State University,Alamosa,81101,"3,000","Alamosa County commercial property tax ~0.9%. Limited public transit."
CO,Colorado Mesa University,Grand Junction,81501,"11,000","Mesa County commercial property tax ~0.9%. Accessible via GVT."
CO,CSU Pueblo,Pueblo,81001,"4,000","Pueblo County commercial property tax ~1.0%. Accessible via Pueblo Transit."
CT,University of Connecticut,Storrs,06269,"27,000","Tolland County commercial property tax ~2.0%. Accessible via CTtransit."
CT,Central Connecticut State University,New Britain,06050,"11,000","Hartford County commercial property tax ~2.5%. Accessible via CTfastrak."
CT,Southern Connecticut State University,New Haven,06515,"9,000","New Haven County commercial property tax ~2.8%. Accessible via CTtransit."
CT,Eastern Connecticut State University,Willimantic,06226,"5,000","Windham County commercial property tax ~2.2%. Accessible via WRTD."
CT,Western Connecticut State University,Danbury,06810,"5,000","Fairfield County commercial property tax ~2.0%. Accessible via HARTransit."
DE,University of Delaware,Newark,19716,"24,000","New Castle County commercial property tax ~0.8%. Accessible via SEPTA, DART."
DE,Delaware State University,Dover,19901,"5,000","Kent County commercial property tax ~0.7%. Accessible via DART."
FL,University of Florida,Gainesville,32611,"55,000","Alachua County commercial property tax ~1.5%. Accessible via RTS."
FL,Florida State University,Tallahassee,32306,"44,000","Leon County commercial property tax ~1.5%. Accessible via StarMetro."
FL,University of Central Florida,Orlando,32816,"70,000","Orange County commercial property tax ~1.4%. Accessible via LYNX."
FL,University of South Florida,Tampa,33620,"50,000","Hillsborough County commercial property tax ~1.6%. Accessible via HART."
FL,Florida International University,Miami,33199,"58,000","Miami-Dade County commercial property tax ~1.8%. Accessible via Miami-Dade Transit."
FL,University of North Florida,Jacksonville,32224,"17,000","Duval County commercial property tax ~1.4%. Accessible via JTA."
FL,Florida Atlantic University,Boca Raton,33431,"30,000","Palm Beach County commercial property tax ~1.5%. Accessible via Palm Tran."
FL,Florida A&M University,Tallahassee,32307,"10,000","Leon County commercial property tax ~1.5%. Accessible via StarMetro."
FL,University of West Florida,Pensacola,32514,"13,000","Escambia County commercial property tax ~1.3%. Accessible via ECAT."
FL,Florida Gulf Coast University,Fort Myers,33965,"15,000","Lee County commercial property tax ~1.4%. Accessible via LeeTran."
FL,New College of Florida,Sarasota,34243,"700","Sarasota County commercial property tax ~1.3%. Accessible via SCAT."
FL,Florida Polytechnic University,Lakeland,33805,"1,500","Polk County commercial property tax ~1.5%. Accessible via Citrus Connection."
GA,University of Georgia,Athens,30602,"40,000","Clarke County commercial property tax ~1.4%. Accessible via Athens-Clarke County Transit."
GA,Georgia Institute of Technology,Atlanta,30332,"44,000","Fulton County commercial property tax ~1.5%. Accessible via MARTA."
GA,Georgia State University,Atlanta,30303,"53,000","Fulton County commercial property tax ~1.5%. Accessible via MARTA."
GA,Kennesaw State University,Kennesaw,30144,"43,000","Cobb County commercial property tax ~1.3%. Accessible via CobbLinc."
GA,Georgia Southern University,Statesboro,30460,"27,000","Bulloch County commercial property tax ~1.2%. Accessible via Statesboro Area Transit."
GA,Augusta University,Augusta,30912,"9,000","Richmond County commercial property tax ~1.4%. Accessible via Augusta Transit."
GA,University of West Georgia,Carrollton,30118,"13,000","Carroll County commercial property tax ~1.2%. Limited public transit."
GA,Valdosta State University,Valdosta,31698,"12,000","Lowndes County commercial property tax ~1.3%. Accessible via VLPRA."
GA,University of North Georgia,Dahlonega,30597,"19,000","Lumpkin County commercial property tax ~1.1%. Limited public transit."
GA,Columbus State University,Columbus,31907,"8,000","Muscogee County commercial property tax ~1.4%. Accessible via METRA."
GA,Georgia College & State University,Milledgeville,31061,"7,000","Baldwin County commercial property tax ~1.2%. Limited public transit."
GA,Savannah State University,Savannah,31404,"3,500","Chatham County commercial property tax ~1.3%. Accessible via CAT."
GA,Albany State University,Albany,31705,"6,000","Dougherty County commercial property tax ~1.4%. Accessible via Albany Transit."
GA,Fort Valley State University,Fort Valley,31030,"3,000","Peach County commercial property tax ~1.2%. Limited public transit."
GA,Clayton State University,Morrow,30260,"7,000","Clayton County commercial property tax ~1.5%. Accessible via MARTA."
GA,Middle Georgia State University,Macon,31206,"8,000","Bibb County commercial property tax ~1.5%. Accessible via MTA."
ID,Boise State University,Boise,83725,"26,000","Ada County commercial property tax ~1.1%. Accessible via Valley Regional Transit."
ID,University of Idaho,Moscow,83844,"11,000","Latah County commercial property tax ~1.0%. Accessible via SMART Transit."
ID,Idaho State University,Pocatello,83209,"12,000","Bannock County commercial property tax ~1.2%. Accessible via Pocatello Regional Transit."
ID,Lewis-Clark State College,Lewiston,83501,"4,000","Nez Perce County commercial property tax ~1.3%. Accessible via Lewiston Transit System."
IL,University of Illinois Urbana-Champaign,Urbana,61801,"56,000","Champaign County commercial property tax ~2.5%. Accessible via C-U MTD."
IL,University of Illinois Chicago,Chicago,60607,"34,000","Cook County commercial property tax ~2.5%. Accessible via CTA."
IL,Northern Illinois University,DeKalb,60115,"16,000","DeKalb County commercial property tax ~2.8%. Accessible via Huskie Line."
IL,Illinois State University,Normal,61761,"20,000","McLean County commercial property tax ~2.4%. Accessible via Connect Transit."
IL,Southern Illinois University Carbondale,Carbondale,62901,"11,000","Jackson County commercial property tax ~2.6%. Accessible via Saluki Express."
IL,Southern Illinois University Edwardsville,Edwardsville,62026,"13,000","Madison County commercial property tax ~2.7%. Accessible via MCT."
IL,Eastern Illinois University,Charleston,61920,"8,000","Coles County commercial property tax ~2.5%. Accessible via Panther Shuttle."
IL,Western Illinois University,Macomb,61455,"7,000","McDonough County commercial property tax ~2.4%. Accessible via Go West."
IL,Northeastern Illinois University,Chicago,60625,"7,000","Cook County commercial property tax ~2.5%. Accessible via CTA."
IL,Chicago State University,Chicago,60628,"3,000","Cook County commercial property tax ~2.5%. Accessible via CTA."
IL,Governors State University,University Park,60484,"5,000","Will County commercial property tax ~2.6%. Accessible via Pace."
IL,University of Illinois Springfield,Springfield,62703,"4,000","Sangamon County commercial property tax ~2.3%. Accessible via SMTD."
IN,Purdue University,West Lafayette,47907,"50,000","Tippecanoe County commercial property tax ~1.0%. Accessible via CityBus."
IN,Indiana University Bloomington,Bloomington,47405,"47,000","Monroe County commercial property tax ~1.1%. Accessible via Bloomington Transit."
IN,Ball State University,Muncie,47306,"21,000","Delaware County commercial property tax ~1.2%. Accessible via MITS."
IN,Indiana University-Purdue University Indianapolis (IUPUI),Indianapolis,46202,"29,000","Marion County commercial property tax ~1.5%. Accessible via IndyGo."
IN,Indiana State University,Terre Haute,47809,"10,000","Vigo County commercial property tax ~1.3%. Accessible via Terre Haute Transit."
IN,University of Southern Indiana,Evansville,47712,"9,000","Vanderburgh County commercial property tax ~1.2%. Accessible via METS."
IN,Purdue University Fort Wayne,Fort Wayne,46805,"10,000","Allen County commercial property tax ~1.3%. Accessible via Citilink."
IN,Indiana University Northwest,Gary,46408,"4,000","Lake County commercial property tax ~1.6%. Accessible via GPTC."
IN,Indiana University South Bend,South Bend,46634,"5,000","St. Joseph County commercial property tax ~1.4%. Accessible via Transpo."
IN,Indiana University Southeast,New Albany,47150,"4,000","Floyd County commercial property tax ~1.2%. Accessible via TARC."
IN,Indiana University East,Richmond,47374,"3,000","Wayne County commercial property tax ~1.2%. Accessible via Rose View Transit."
IN,Indiana University Kokomo,Kokomo,46904,"3,000","Howard County commercial property tax ~1.3%. Accessible via Kokomo City Line."
IA,University of Iowa,Iowa City,52242,"31,000","Johnson County commercial property tax ~2.0%. Accessible via Iowa City Transit."
IA,Iowa State University,Ames,50011,"33,000","Story County commercial property tax ~1.9%. Accessible via CyRide."
IA,University of Northern Iowa,Cedar Falls,50614,"9,000","Black Hawk County commercial property tax ~2.1%. Accessible via MET Transit."
KS,University of Kansas,Lawrence,66045,"27,000","Douglas County commercial property tax ~1.8%. Accessible via Lawrence Transit."
KS,Kansas State University,Manhattan,66506,"21,000","Riley County commercial property tax ~1.7%. Accessible via aTa Bus."
KS,Wichita State University,Wichita,67260,"16,000","Sedgwick County commercial property tax ~1.9%. Accessible via Wichita Transit."
KS,Emporia State University,Emporia,66801,"6,000","Lyon County commercial property tax ~1.8%. Accessible via L-CAT."
KS,Pittsburg State University,Pittsburg,66762,"7,000","Crawford County commercial property tax ~1.9%. Accessible via SPARTRAN."
KS,Fort Hays State University,Hays,67601,"15,000","Ellis County commercial property tax ~1.6%. Limited public transit."
KS,Washburn University,Topeka,66621,"6,000","Shawnee County commercial property tax ~2.0%. Accessible via Topeka Metro."
KY,University of Kentucky,Lexington,40506,"31,000","Fayette County commercial property tax ~1.2%. Accessible via Lextran."
KY,University of Louisville,Louisville,40292,"22,000","Jefferson County commercial property tax ~1.3%. Accessible via TARC."
KY,Western Kentucky University,Bowling Green,42101,"17,000","Warren County commercial property tax ~1.0%. Accessible via GO BG."
KY,Eastern Kentucky University,Richmond,40475,"14,000","Madison County commercial property tax ~1.0%. Accessible via Big E Transit."
KY,Northern Kentucky University,Highland Heights,41099,"16,000","Campbell County commercial property tax ~1.1%. Accessible via TANK."
KY,Murray State University,Murray,42071,"9,000","Calloway County commercial property tax ~0.9%. Accessible via MUTS."
KY,Morehead State University,Morehead,40351,"9,000","Rowan County commercial property tax ~1.0%. Accessible via Morehead Transit."
KY,Kentucky State University,Frankfort,40601,"2,000","Franklin County commercial property tax ~1.1%. Accessible via Frankfort Transit."
LA,Louisiana State University,Baton Rouge,70803,"35,000","East Baton Rouge Parish commercial property tax ~1.4%. Accessible via CATS."
LA,Tulane University,New Orleans,70118,"14,000","Orleans Parish commercial property tax ~1.6%. Accessible via RTA. *Note: Tulane is a private university.*"
LA,University of Louisiana at Lafayette,Lafayette,70504,"19,000","Lafayette Parish commercial property tax ~1.3%. Accessible via LTS."
LA,Louisiana Tech University,Ruston,71272,"11,000","Lincoln Parish commercial property tax ~1.2%. Accessible via KTBS."
LA,University of New Orleans,New Orleans,70148,"8,000","Orleans Parish commercial property tax ~1.6%. Accessible via RTA."
LA,Southeastern Louisiana University,Hammond,70402,"14,000","Tangipahoa Parish commercial property tax ~1.3%. Limited public transit."
LA,University of Louisiana at Monroe,Monroe,71209,"9,000","Ouachita Parish commercial property tax ~1.4%. Accessible via Monroe Transit."
LA,McNeese State University,Lake Charles,70609,"7,000","Calcasieu Parish commercial property tax ~1.4%. Accessible via Lake Charles Transit."
LA,Nicholls State University,Thibodaux,70310,"6,000","Lafourche Parish commercial property tax ~1.3%. Limited public transit."
LA,Grambling State University,Grambling,71245,"5,000","Lincoln Parish commercial property tax ~1.2%. Limited public transit."
LA,Southern University and A&M College,Baton Rouge,70813,"7,000","East Baton Rouge Parish commercial property tax ~1.4%. Accessible via CATS."
LA,Northwestern State University of Louisiana,Natchitoches,71497,"11,000","Natchitoches Parish commercial property tax ~1.2%. Limited public transit."
ME,University of Maine,Orono,04469,"11,500","Penobscot County commercial property tax ~1.8%. Accessible via Community Connector."
ME,University of Southern Maine,Portland,04103,"8,000","Cumberland County commercial property tax ~1.9%. Accessible via Greater Portland METRO."
ME,University of Maine at Augusta,Augusta,04330,"4,500","Kennebec County commercial property tax ~2.0%. Accessible via Kennebec Explorer."
ME,University of Maine at Farmington,Farmington,04938,"2,000","Franklin County commercial property tax ~1.9%. Limited public transit."
ME,University of Maine at Fort Kent,Fort Kent,04743,"1,500","Aroostook County commercial property tax ~1.7%. Limited public transit."
ME,University of Maine at Presque Isle,Presque Isle,04769,"1,500","Aroostook County commercial property tax ~1.7%. Accessible via The County Connection."
ME,University of Maine at Machias,Machias,04654,"800","Washington County commercial property tax ~1.6%. Limited public transit."
ME,Maine Maritime Academy,Castine,04420,"1,000","Hancock County commercial property tax ~1.5%. Limited public transit."
MD,University of Maryland, College Park,College Park,20742,"41,000","Prince George's County commercial property tax ~1.8%. Accessible via WMATA."
MD,Towson University,Towson,21252,"22,000","Baltimore County commercial property tax ~1.9%. Accessible via MTA."
MD,University of Maryland, Baltimore County,Baltimore,21250,"14,000","Baltimore County commercial property tax ~1.9%. Accessible via MTA."
MD,Salisbury University,Salisbury,21801,"8,500","Wicomico County commercial property tax ~1.5%. Accessible via Shore Transit."
MD,University of Baltimore,Baltimore,21201,"5,000","Baltimore City commercial property tax ~2.2%. Accessible via MTA."
MD,Morgan State University,Baltimore,21251,"8,000","Baltimore City commercial property tax ~2.2%. Accessible via MTA."
MD,Frostburg State University,Frostburg,21532,"5,000","Allegany County commercial property tax ~1.6%. Limited public transit."
MD,Bowie State University,Bowie,20715,"6,000","Prince George's County commercial property tax ~1.8%. Accessible via TheBus."
MD,Coppin State University,Baltimore,21216,"2,500","Baltimore City commercial property tax ~2.2%. Accessible via MTA."
MD,University of Maryland Eastern Shore,Princess Anne,21853,"2,500","Somerset County commercial property tax ~1.4%. Limited public transit."
MD,St. Mary's College of Maryland,St. Mary's City,20686,"1,500","St. Mary's County commercial property tax ~1.3%. Limited public transit."
MA,University of Massachusetts Amherst,Amherst,01003,"32,000","Hampshire County commercial property tax ~1.5%. Accessible via PVTA."
MA,University of Massachusetts Boston,Boston,02125,"16,000","Suffolk County commercial property tax ~2.5%. Accessible via MBTA."
MA,University of Massachusetts Dartmouth,Dartmouth,02747,"8,500","Bristol County commercial property tax ~1.7%. Accessible via SRTA."
MA,University of Massachusetts Lowell,Lowell,01854,"18,000","Middlesex County commercial property tax ~1.9%. Accessible via LRTA."
MA,Bridgewater State University,Bridgewater,02325,"10,000","Plymouth County commercial property tax ~1.6%. Accessible via BAT."
MA,Fitchburg State University,Fitchburg,01420,"7,000","Worcester County commercial property tax ~1.8%. Accessible via MART."
MA,Framingham State University,Framingham,01701,"6,500","Middlesex County commercial property tax ~1.9%. Accessible via MWRTA."
MA,Salem State University,Salem,01970,"7,000","Essex County commercial property tax ~1.7%. Accessible via MBTA."
MA,Westfield State University,Westfield,01086,"6,000","Hampden County commercial property tax ~1.8%. Accessible via PVTA."
MA,Worcester State University,Worcester,01602,"6,000","Worcester County commercial property tax ~1.8%. Accessible via WRTA."
MA,Massachusetts College of Art and Design,Boston,02115,"2,000","Suffolk County commercial property tax ~2.5%. Accessible via MBTA."
