TN,Tennessee Technological University,Cookeville,38505,"10,000","Putnam County commercial property tax ~1.7%. Accessible via UCARTS."
TN,Austin Peay State University,Clarksville,37044,"10,000","Montgomery County commercial property tax ~1.9%. Accessible via CTS."
TN,University of Tennessee at Chattanooga,Chattanooga,37403,"11,000","Hamilton County commercial property tax ~2.1%. Accessible via CARTA."
TN,Tennessee State University,Nashville,37209,"8,000","Davidson County commercial property tax ~2.3%. Accessible via WeGo."
TN,University of Tennessee at Martin,Martin,38238,"7,000","Weakley County commercial property tax ~1.7%. Limited public transit."
TX,Texas A&M University,College Station,77843,"73,000","Brazos County commercial property tax ~1.8%. Accessible via The Bus."
TX,The University of Texas at Austin,Austin,78712,"52,000","Travis County commercial property tax ~2.0%. Accessible via CapMetro."
TX,University of Houston,Houston,77204,"47,000","Harris County commercial property tax ~2.2%. Accessible via METRO."
TX,The University of Texas at Arlington,Arlington,76019,"48,000","Tarrant County commercial property tax ~2.1%. Accessible via Arlington Transit."
TX,University of North Texas,Denton,76203,"42,000","Denton County commercial property tax ~1.9%. Accessible via DCTA."
TX,Texas State University,San Marcos,78666,"38,000","Hays County commercial property tax ~1.9%. Accessible via The Bus."
TX,The University of Texas at Dallas,Richardson,75080,"31,000","Dallas County commercial property tax ~2.2%. Accessible via DART."
TX,The University of Texas at San Antonio,San Antonio,78249,"34,000","Bexar County commercial property tax ~2.0%. Accessible via VIA."
TX,Texas Tech University,Lubbock,79409,"40,000","Lubbock County commercial property tax ~1.8%. Accessible via Citibus."
TX,The University of Texas at El Paso,El Paso,79968,"25,000","El Paso County commercial property tax ~2.3%. Accessible via Sun Metro."
TX,Sam Houston State University,Huntsville,77341,"21,000","Walker County commercial property tax ~1.7%. Accessible via Huntsville Shuttle."
TX,Stephen F. Austin State University,Nacogdoches,75962,"12,000","Nacogdoches County commercial property tax ~1.6%. Limited public transit."
TX,Texas Woman's University,Denton,76204,"16,000","Denton County commercial property tax ~1.9%. Accessible via DCTA."
TX,Prairie View A&M University,Prairie View,77446,"9,500","Waller County commercial property tax ~2.0%. Limited public transit."
TX,Tarleton State University,Stephenville,76402,"14,000","Erath County commercial property tax ~1.7%. Accessible via The Shuttle."
TX,West Texas A&M University,Canyon,79016,"10,000","Randall County commercial property tax ~1.7%. Limited public transit."
TX,Texas A&M University-Corpus Christi,Corpus Christi,78412,"11,000","Nueces County commercial property tax ~2.1%. Accessible via CCRTA."
TX,Texas Southern University,Houston,77004,"9,000","Harris County commercial property tax ~2.2%. Accessible via METRO."
TX,Lamar University,Beaumont,77710,"17,000","Jefferson County commercial property tax ~2.3%. Accessible via Beaumont Municipal Transit."
UT,University of Utah,Salt Lake City,84112,"34,000","Salt Lake County commercial property tax ~1.4%. Accessible via UTA."
UT,Utah State University,Logan,84322,"28,000","Cache County commercial property tax ~1.2%. Accessible via CVTD."
UT,Weber State University,Ogden,84408,"29,000","Weber County commercial property tax ~1.3%. Accessible via UTA."
UT,Utah Valley University,Orem,84058,"41,000","Utah County commercial property tax ~1.1%. Accessible via UTA."
UT,Southern Utah University,Cedar City,84720,"14,000","Iron County commercial property tax ~1.0%. Accessible via Cedar Area Transportation."
UT,Dixie State University,St. George,84770,"12,000","Washington County commercial property tax ~1.0%. Accessible via SunTran."
UT,Snow College,Ephraim,84627,"6,000","Sanpete County commercial property tax ~0.9%. Limited public transit."
UT,Salt Lake Community College,Salt Lake City,84130,"27,000","Salt Lake County commercial property tax ~1.4%. Accessible via UTA."
VT,University of Vermont,Burlington,05405,"13,000","Chittenden County commercial property tax ~1.8%. Accessible via GMT."
VT,Castleton University,Castleton,05735,"2,000","Rutland County commercial property tax ~1.9%. Accessible via The Bus."
VT,Northern Vermont University,Johnson,05656,"1,500","Lamoille County commercial property tax ~1.7%. Limited public transit."
VT,Northern Vermont University-Lyndon,Lyndonville,05851,"1,000","Caledonia County commercial property tax ~1.8%. Accessible via RCT."
VT,Vermont Technical College,Randolph Center,05061,"1,500","Orange County commercial property tax ~1.9%. Accessible via Stagecoach."
VA,Virginia Tech,Blacksburg,24061,"37,000","Montgomery County commercial property tax ~1.0%. Accessible via Blacksburg Transit."
VA,University of Virginia,Charlottesville,22904,"26,000","Albemarle County commercial property tax ~0.9%. Accessible via CAT."
VA,Virginia Commonwealth University,Richmond,23284,"30,000","Richmond City commercial property tax ~1.2%. Accessible via GRTC."
VA,George Mason University,Fairfax,22030,"39,000","Fairfax County commercial property tax ~1.1%. Accessible via CUE Bus, WMATA."
VA,Old Dominion University,Norfolk,23529,"24,000","Norfolk City commercial property tax ~1.3%. Accessible via HRT."
VA,James Madison University,Harrisonburg,22807,"22,000","Rockingham County commercial property tax ~0.8%. Accessible via Harrisonburg Transit."
VA,Radford University,Radford,24142,"11,000","Radford City commercial property tax ~1.0%. Accessible via Radford Transit."
VA,William & Mary,Williamsburg,23187,"9,000","Williamsburg City commercial property tax ~0.8%. Accessible via WATA."
VA,Virginia State University,Petersburg,23806,"4,000","Chesterfield County commercial property tax ~1.1%. Accessible via GRTC."
VA,Norfolk State University,Norfolk,23504,"5,000","Norfolk City commercial property tax ~1.3%. Accessible via HRT."
VA,Longwood University,Farmville,23909,"5,000","Prince Edward County commercial property tax ~0.7%. Accessible via Farmville Area Bus."
VA,University of Mary Washington,Fredericksburg,22401,"4,000","Fredericksburg City commercial property tax ~1.0%. Accessible via FRED."
VA,Christopher Newport University,Newport News,23606,"5,000","Newport News City commercial property tax ~1.2%. Accessible via HRT."
VA,University of Virginia's College at Wise,Wise,24293,"2,000","Wise County commercial property tax ~0.8%. Limited public transit."
WA,University of Washington,Seattle,98195,"49,000","King County commercial property tax ~1.0%. Accessible via King County Metro, Link Light Rail."
WA,Washington State University,Pullman,99164,"31,000","Whitman County commercial property tax ~1.2%. Accessible via Pullman Transit."
WA,Western Washington University,Bellingham,98225,"16,000","Whatcom County commercial property tax ~1.1%. Accessible via WTA."
WA,Central Washington University,Ellensburg,98926,"11,000","Kittitas County commercial property tax ~1.3%. Accessible via Central Transit."
WA,Eastern Washington University,Cheney,99004,"12,000","Spokane County commercial property tax ~1.3%. Accessible via STA."
WA,The Evergreen State College,Olympia,98505,"2,000","Thurston County commercial property tax ~1.2%. Accessible via Intercity Transit."
WV,West Virginia University,Morgantown,26506,"28,000","Monongalia County commercial property tax ~1.2%. Accessible via Mountain Line."
WV,Marshall University,Huntington,25755,"12,000","Cabell County commercial property tax ~1.3%. Accessible via TTA."
WV,Fairmont State University,Fairmont,26554,"3,500","Marion County commercial property tax ~1.1%. Accessible via MCT."
WV,Shepherd University,Shepherdstown,25443,"3,000","Jefferson County commercial property tax ~0.9%. Accessible via EPTA."
WV,West Liberty University,West Liberty,26074,"2,500","Ohio County commercial property tax ~1.2%. Accessible via OVRTA."
WV,Concord University,Athens,24712,"2,000","Mercer County commercial property tax ~1.0%. Accessible via BCT."
WV,West Virginia State University,Institute,25112,"3,000","Kanawha County commercial property tax ~1.4%. Accessible via KRT."
WV,Glenville State College,Glenville,26351,"1,500","Gilmer County commercial property tax ~1.0%. Limited public transit."
WV,Bluefield State College,Bluefield,24701,"1,500","Mercer County commercial property tax ~1.0%. Accessible via BCT."
WI,University of Wisconsin-Madison,Madison,53706,"48,000","Dane County commercial property tax ~2.2%. Accessible via Madison Metro."
WI,University of Wisconsin-Milwaukee,Milwaukee,53211,"24,000","Milwaukee County commercial property tax ~2.8%. Accessible via MCTS."
WI,University of Wisconsin-Oshkosh,Oshkosh,54901,"14,000","Winnebago County commercial property tax ~2.0%. Accessible via GO Transit."
WI,University of Wisconsin-Whitewater,Whitewater,53190,"12,000","Walworth County commercial property tax ~1.8%. Accessible via Whitewater Transit."
WI,University of Wisconsin-La Crosse,La Crosse,54601,"10,000","La Crosse County commercial property tax ~2.1%. Accessible via MTU."
WI,University of Wisconsin-Eau Claire,Eau Claire,54701,"10,000","Eau Claire County commercial property tax ~2.0%. Accessible via Eau Claire Transit."
WI,University of Wisconsin-Green Bay,Green Bay,54311,"9,000","Brown County commercial property tax ~2.1%. Accessible via Green Bay Metro."
WI,University of Wisconsin-Stout,Menomonie,54751,"8,000","Dunn County commercial property tax ~1.9%. Accessible via Dunn County Transit."
WI,University of Wisconsin-Platteville,Platteville,53818,"7,000","Grant County commercial property tax ~1.8%. Accessible via Platteville Public Transit."
WI,University of Wisconsin-River Falls,River Falls,54022,"6,000","Pierce County commercial property tax ~1.7%. Limited public transit."
WI,University of Wisconsin-Stevens Point,Stevens Point,54481,"8,000","Portage County commercial property tax ~2.0%. Accessible via Stevens Point Transit."
WI,University of Wisconsin-Superior,Superior,54880,"2,500","Douglas County commercial property tax ~2.2%. Accessible via DTA."
WI,University of Wisconsin-Parkside,Kenosha,53144,"4,000","Kenosha County commercial property tax ~2.4%. Accessible via Kenosha Area Transit."
WY,University of Wyoming,Laramie,82071,"12,000","Albany County commercial property tax ~1.0%. Accessible via UWYO Roundup."
