State,University Name,City,ZIP Code,Enrollment (approx.),Notes (Accessibility, Taxes, etc.)
ND,North Dakota State University,Fargo,58102,"14,000",Cass County commercial property tax ~1.2%. Accessible via MATBUS.
ND,University of North Dakota,Grand Forks,58202,"13,000",Grand Forks County commercial property tax ~1.3%. Accessible via CAT.
ND,Minot State University,Minot,58707,"3,000",Ward County commercial property tax ~1.1%. Accessible via Minot City Transit.
ND,Valley City State University,Valley City,58072,"1,500",Barnes County commercial property tax ~1.0%. Limited public transit.
ND,Dickinson State University,Dickinson,58601,"1,500",Stark County commercial property tax ~1.0%. Limited public transit.
ND,Mayville State University,Mayville,58257,"1,000",Traill County commercial property tax ~1.1%. Limited public transit.
