State,University Name,City,ZIP Code,Surrounding ZIPs (5-mile radius),Enrollment (approx.),Notes (Accessibility, Taxes, etc.)
TN,University of Tennessee, Knoxville,Knoxville,37996,"37902, 37914, 37915, 37916, 37917, 37919, 37920, 37921",31000,Knox County commercial property tax ~2.2%. Accessible via KAT.
TN,University of Memphis,Memphis,38152,"38111, 38112, 38122, 38152",22000,Shelby County commercial property tax ~2.5%. Accessible via MATA.
TN,Middle Tennessee State University,Murfreesboro,37132,"37129, 37130, 37132",21000,Rutherford County commercial property tax ~1.8%. Accessible via Rover.
TN,East Tennessee State University,Johnson City,37614,"37601, 37604, 37614, 37615",14000,Washington County commercial property tax ~1.6%. Accessible via Johnson City Transit.
TN,Tennessee Technological University,Cookeville,38505,"38501, 38505, 38506",10000,Putnam County commercial property tax ~1.7%. Accessible via UCARTS.
TN,Austin Peay State University,Clarksville,37044,"37040, 37042, 37043, 37044",10000,Montgomery County commercial property tax ~1.9%. Accessible via CTS.
TN,University of Tennessee at Chattanooga,Chattanooga,37403,"37402, 37403, 37404, 37405, 37406, 37408, 37409, 37411, 37412, 37415",11000,Hamilton County commercial property tax ~2.1%. Accessible via CARTA.
TN,Tennessee State University,Nashville,37209,"37203, 37208, 37209, 37218",8000,Davidson County commercial property tax ~2.3%. Accessible via WeGo.
TN,University of Tennessee at Martin,Martin,38238,"38237, 38238",7000,Weakley County commercial property tax ~1.7%. Limited public transit.
